{
  "$schema": "https://json-schema.org/draft/2020-12/schema",
  "$id": "https://lakshya.app/schema/lakshya.schema.json",
  "title": "LakshyaGraph",
  "description": "Full Lakshya graph document. A single JSON file stored in the app data directory holding every node, every edge, every manual priority pin, every dashboard filter preset, and global settings.",
  "type": "object",
  "required": ["schemaVersion", "nodes", "edges"],
  "additionalProperties": false,
  "properties": {
    "schemaVersion": {
      "type": "integer",
      "minimum": 1,
      "description": "Schema version of this document. Bumped on breaking changes so the repository layer can run migrations."
    },
    "nodes": {
      "type": "array",
      "items": { "$ref": "#/$defs/Node" }
    },
    "edges": {
      "type": "array",
      "items": { "$ref": "#/$defs/Edge" }
    },
    "relationships": {
      "type": "array",
      "items": { "$ref": "#/$defs/NodeRelationship" },
      "description": "Non-structural connections between nodes: importance overrides ('moreImportantThan', 'lessImportantThan') and alternatives ('alternativeTo'). Distinct from edges, which describe the goal hierarchy."
    },
    "filterPresets": {
      "type": "array",
      "items": { "$ref": "#/$defs/FilterPreset" }
    },
    "settings": { "$ref": "#/$defs/Settings" }
  },
  "$defs": {
    "Node": {
      "type": "object",
      "required": ["id", "title", "status", "createdAt"],
      "additionalProperties": false,
      "properties": {
        "id": { "type": "string", "minLength": 1 },
        "title": { "type": "string", "minLength": 1 },
        "description": { "type": "string" },
        "status": { "$ref": "#/$defs/NodeStatus" },
        "impact": {
          "type": "string",
          "enum": ["minimal", "low", "medium", "high", "critical"],
          "description": "Fixed five-level user estimate of how impactful completing this node is. Used by the default ordering for non-urgent tasks. Relative importance between specific nodes is expressed via a relationship instead."
        },
        "deadline": {
          "type": "string",
          "format": "date-time",
          "description": "Hard deadline for this node. Drives deadline reminders."
        },
        "attachments": {
          "type": "array",
          "items": { "$ref": "#/$defs/Attachment" }
        },
        "notificationOverride": { "$ref": "#/$defs/NodeNotificationSettings" },
        "createdAt": { "type": "string", "format": "date-time" },
        "updatedAt": { "type": "string", "format": "date-time" }
      }
    },
    "NodeStatus": {
      "type": "object",
      "required": ["activation"],
      "additionalProperties": false,
      "description": "Composite of two orthogonal axes: when the node is live (activation) and what it means to be done (completion). Either axis can be set independently, allowing e.g. 'active only during May, must be done 3 times in that window'.",
      "properties": {
        "activation": { "$ref": "#/$defs/ActivationWindow" },
        "completion": { "$ref": "#/$defs/Completion" }
      }
    },
    "ActivationWindow": {
      "description": "Discriminated union: 'always_active' or 'bounded' (with from/until).",
      "oneOf": [
        { "$ref": "#/$defs/ActivationAlwaysActive" },
        { "$ref": "#/$defs/ActivationBounded" }
      ]
    },
    "ActivationAlwaysActive": {
      "type": "object",
      "required": ["kind"],
      "additionalProperties": false,
      "properties": { "kind": { "const": "always_active" } }
    },
    "ActivationBounded": {
      "type": "object",
      "required": ["kind"],
      "additionalProperties": false,
      "description": "Either or both dates may be omitted: only-from = active from that date onward; only-until = active until that date; both = closed interval.",
      "properties": {
        "kind": { "const": "bounded" },
        "activeFrom": { "type": "string", "format": "date-time" },
        "activeUntil": { "type": "string", "format": "date-time" }
      }
    },
    "Completion": {
      "description": "Discriminated union of completion semantics. Absent (null) means this is a background goal with no completion concept.",
      "oneOf": [
        { "$ref": "#/$defs/CompletionOneTime" },
        { "$ref": "#/$defs/CompletionNTimes" },
        { "$ref": "#/$defs/CompletionPeriodic" }
      ]
    },
    "CompletionOneTime": {
      "type": "object",
      "required": ["kind"],
      "additionalProperties": false,
      "properties": {
        "kind": { "const": "one_time" },
        "completedAt": { "type": "string", "format": "date-time" }
      }
    },
    "CompletionNTimes": {
      "type": "object",
      "required": ["kind", "targetCount"],
      "additionalProperties": false,
      "properties": {
        "kind": { "const": "n_times" },
        "targetCount": { "type": "integer", "minimum": 1 },
        "completedCount": { "type": "integer", "minimum": 0 },
        "lastCompletedAt": { "type": "string", "format": "date-time" }
      }
    },
    "CompletionPeriodic": {
      "type": "object",
      "required": ["kind", "intervalDaysSinceLastCompletion"],
      "additionalProperties": false,
      "properties": {
        "kind": { "const": "periodic" },
        "intervalDaysSinceLastCompletion": { "type": "integer", "minimum": 1 },
        "lastCompletedAt": { "type": "string", "format": "date-time" }
      }
    },
    "Attachment": {
      "description": "Discriminated union of attachment kinds linked to a node.",
      "oneOf": [
        { "$ref": "#/$defs/AttachmentUrl" },
        { "$ref": "#/$defs/AttachmentGeoLocation" },
        { "$ref": "#/$defs/AttachmentTimeTrigger" }
      ]
    },
    "AttachmentUrl": {
      "type": "object",
      "required": ["type", "url"],
      "additionalProperties": false,
      "properties": {
        "type": { "const": "url" },
        "url": { "type": "string", "format": "uri" },
        "label": { "type": "string" }
      }
    },
    "AttachmentGeoLocation": {
      "type": "object",
      "required": ["type", "latitude", "longitude"],
      "additionalProperties": false,
      "properties": {
        "type": { "const": "geo_location" },
        "latitude": { "type": "number", "minimum": -90, "maximum": 90 },
        "longitude": { "type": "number", "minimum": -180, "maximum": 180 },
        "label": { "type": "string" }
      }
    },
    "AttachmentTimeTrigger": {
      "type": "object",
      "required": ["type", "triggerAt"],
      "additionalProperties": false,
      "description": "Fires a reminder at the given moment, independent of any deadline on the node.",
      "properties": {
        "type": { "const": "time_trigger" },
        "triggerAt": { "type": "string", "format": "date-time" },
        "label": { "type": "string" }
      }
    },
    "NodeNotificationSettings": {
      "type": "object",
      "additionalProperties": false,
      "description": "Per-node override of the global notification defaults. Unset fields fall back to global Settings.",
      "properties": {
        "deadlineLeadTimeHours": { "type": "integer", "minimum": 0 },
        "notifyOnPeriodicReopen": { "type": "boolean" }
      }
    },
    "Edge": {
      "type": "object",
      "required": ["id", "childId", "parentId", "contribution"],
      "additionalProperties": false,
      "description": "Directed contribution from a child node to a parent goal. A node can have many parents; the same child appears in multiple edges.",
      "properties": {
        "id": { "type": "string", "minLength": 1 },
        "childId": {
          "type": "string",
          "description": "The lower-level node that contributes upward."
        },
        "parentId": {
          "type": "string",
          "description": "The higher-level goal being contributed to."
        },
        "contribution": {
          "type": "string",
          "enum": ["mandatory", "helpful"],
          "description": "Mandatory: parent is not fulfillable without this child. Helpful: child assists but is not required."
        }
      }
    },
    "NodeRelationship": {
      "type": "object",
      "required": ["id", "fromNodeId", "toNodeId", "kind"],
      "additionalProperties": false,
      "description": "A non-structural connection between two nodes. Directional kinds ('moreImportantThan', 'lessImportantThan') carry meaning in the order of (fromNodeId, toNodeId). The bidirectional kind 'alternativeTo' is symmetric and additionally cascades completion — closing one alternative closes the other.",
      "properties": {
        "id": { "type": "string", "minLength": 1 },
        "fromNodeId": { "type": "string", "minLength": 1 },
        "toNodeId": { "type": "string", "minLength": 1 },
        "kind": {
          "type": "string",
          "enum": ["moreImportantThan", "lessImportantThan", "alternativeTo"]
        }
      }
    },
    "FilterPreset": {
      "type": "object",
      "required": ["id", "title", "filter"],
      "additionalProperties": false,
      "description": "Dashboard tile. Tapping the tile opens a list or graph view pre-filtered by this filter.",
      "properties": {
        "id": { "type": "string", "minLength": 1 },
        "title": { "type": "string", "minLength": 1 },
        "iconName": {
          "type": "string",
          "description": "Optional Material icon name for the tile face."
        },
        "ordering": {
          "type": "integer",
          "description": "Sort order of tiles in the dashboard."
        },
        "filter": { "$ref": "#/$defs/Filter" }
      }
    },
    "Filter": {
      "type": "object",
      "additionalProperties": false,
      "description": "Composable filter spec used by the graph view, the todo list view, and dashboard tiles.",
      "properties": {
        "ancestorGoalIds": {
          "type": "array",
          "items": { "type": "string", "minLength": 1 },
          "description": "Keep only nodes that are descendants of at least one of these goals."
        },
        "contribution": {
          "type": "string",
          "enum": ["any", "mandatory", "helpful"],
          "description": "Restrict to incoming edges of this contribution kind when computing descendants."
        },
        "completionKinds": {
          "type": "array",
          "items": {
            "type": "string",
            "enum": ["none", "one_time", "n_times", "periodic"]
          },
          "description": "Keep only nodes whose completion kind matches. 'none' matches background goals (no completion aspect)."
        },
        "activationKinds": {
          "type": "array",
          "items": {
            "type": "string",
            "enum": ["always_active", "bounded"]
          },
          "description": "Keep only nodes whose activation window kind matches."
        },
        "onlyOngoing": {
          "type": "boolean",
          "description": "Keep only currently-actionable nodes: one_time not completed, n_times with completedCount < targetCount, periodic past its next due date, temporarily_active inside its window and not completed."
        },
        "onlyLeaves": {
          "type": "boolean",
          "description": "Keep only nodes that are leaves within the filtered subgraph."
        },
        "freeText": {
          "type": "string",
          "description": "Case-insensitive substring match against node title and description."
        }
      }
    },
    "Settings": {
      "type": "object",
      "additionalProperties": false,
      "properties": {
        "defaultDeadlineLeadTimeHours": {
          "type": "integer",
          "minimum": 0,
          "description": "Default hours before a deadline at which a reminder fires. Nodes may override via notificationOverride."
        },
        "notifyOnPeriodicReopenByDefault": {
          "type": "boolean",
          "description": "Whether a notification fires when a periodic task becomes open again, unless the node overrides it."
        },
        "rootNodeId": {
          "type": "string",
          "description": "ID of the 'all goals achieved' top-level node. The graph engine treats this as the universal ancestor when computing descendant filters with no ancestorGoalIds set."
        },
        "urgentWindowDays": {
          "type": "integer",
          "minimum": 0,
          "description": "Tasks with a deadline this many days or fewer away get top-of-list 'urgent' treatment in the default ordering. Defaults to 3."
        },
        "collapsedNodeIds": {
          "type": "array",
          "items": { "type": "string", "minLength": 1 },
          "description": "Node ids whose children are collapsed in the hierarchical todo list view. Ignored by leaf-only views."
        }
      }
    }
  }
}
