{
  "schemaVersion": 2,
  "settings": {
    "rootNodeId": "root",
    "defaultDeadlineLeadTimeHours": 24,
    "notifyOnPeriodicReopenByDefault": true,
    "urgentWindowDays": 3
  },
  "relationships": [
    { "id": "r-spanish-alt",
      "fromNodeId": "learn-spanish-online",
      "toNodeId": "take-spanish-class",
      "kind": "alternativeTo" },
    { "id": "r-budget-important",
      "fromNodeId": "review-monthly-budget",
      "toNodeId": "organize-paperwork",
      "kind": "moreImportantThan" }
  ],
  "filterPresets": [
    { "id": "fp-today",
      "title": "Today",
      "ordering": 0,
      "filter": { "onlyOngoing": true, "onlyLeaves": true } }
  ],
  "nodes": [
    { "id": "root", "title": "All goals achieved",
      "status": { "activation": { "kind": "always_active" } },
      "createdAt": "2026-01-01T00:00:00.000Z" },

    { "id": "health", "title": "Health & Wellness",
      "status": { "activation": { "kind": "always_active" } },
      "createdAt": "2026-01-01T00:00:00.000Z" },
    { "id": "exercise", "title": "Exercise regularly",
      "status": { "activation": { "kind": "always_active" } },
      "createdAt": "2026-01-01T00:00:00.000Z" },
    { "id": "workout-session", "title": "Workout session",
      "status": { "activation": { "kind": "always_active" },
        "completion": { "kind": "periodic", "intervalDaysSinceLastCompletion": 2 } },
      "impact": "high",
      "createdAt": "2026-01-01T00:00:00.000Z" },
    { "id": "meditate", "title": "Meditate",
      "description": "Even 10 minutes counts.",
      "status": { "activation": { "kind": "always_active" },
        "completion": { "kind": "periodic", "intervalDaysSinceLastCompletion": 1 } },
      "createdAt": "2026-01-01T00:00:00.000Z" },
    { "id": "health-checkup", "title": "Book annual health checkup",
      "status": { "activation": { "kind": "always_active" },
        "completion": { "kind": "periodic", "intervalDaysSinceLastCompletion": 365 } },
      "createdAt": "2026-01-01T00:00:00.000Z" },
    { "id": "stay-hydrated", "title": "Stay hydrated",
      "description": "Drink at least 2L of water per day. Contributes to both health and exercise performance.",
      "status": { "activation": { "kind": "always_active" } },
      "createdAt": "2026-01-01T00:00:00.000Z" },

    { "id": "career", "title": "Career & Work",
      "status": { "activation": { "kind": "always_active" } },
      "createdAt": "2026-01-01T00:00:00.000Z" },
    { "id": "current-project", "title": "Finish current project",
      "status": { "activation": { "kind": "always_active" },
        "completion": { "kind": "one_time" } },
      "impact": "critical",
      "deadline": "2026-03-31T17:00:00.000Z",
      "createdAt": "2026-01-01T00:00:00.000Z" },
    { "id": "prepare-presentation", "title": "Prepare quarterly presentation",
      "description": "Slides + talking points for the team meeting.",
      "status": { "activation": { "kind": "bounded", "activeUntil": "2026-03-15T00:00:00.000Z" },
        "completion": { "kind": "one_time" } },
      "impact": "high",
      "createdAt": "2026-01-01T00:00:00.000Z" },
    { "id": "online-lessons", "title": "Complete 5 online lessons",
      "description": "Demonstrates the N-times completion type: counts down as you complete each lesson.",
      "status": { "activation": { "kind": "always_active" },
        "completion": { "kind": "n_times", "targetCount": 5 } },
      "createdAt": "2026-01-01T00:00:00.000Z" },

    { "id": "relationships", "title": "Relationships",
      "status": { "activation": { "kind": "always_active" } },
      "createdAt": "2026-01-01T00:00:00.000Z" },
    { "id": "call-family", "title": "Call family",
      "status": { "activation": { "kind": "always_active" },
        "completion": { "kind": "periodic", "intervalDaysSinceLastCompletion": 7 } },
      "impact": "medium",
      "createdAt": "2026-01-01T00:00:00.000Z" },
    { "id": "plan-friends-meetup", "title": "Plan a friends meetup",
      "status": { "activation": { "kind": "always_active" },
        "completion": { "kind": "periodic", "intervalDaysSinceLastCompletion": 30 } },
      "createdAt": "2026-01-01T00:00:00.000Z" },

    { "id": "personal-growth", "title": "Personal Growth",
      "status": { "activation": { "kind": "always_active" } },
      "createdAt": "2026-01-01T00:00:00.000Z" },
    { "id": "read-a-book", "title": "Read a book",
      "status": { "activation": { "kind": "always_active" },
        "completion": { "kind": "one_time" } },
      "createdAt": "2026-01-01T00:00:00.000Z" },
    { "id": "learn-spanish-online", "title": "Learn Spanish (online course)",
      "description": "Alternative to the in-person class — completing either one counts.",
      "status": { "activation": { "kind": "always_active" },
        "completion": { "kind": "one_time" } },
      "createdAt": "2026-01-01T00:00:00.000Z" },
    { "id": "take-spanish-class", "title": "Learn Spanish (in-person class)",
      "description": "Alternative to the online course — completing either one counts.",
      "status": { "activation": { "kind": "bounded", "activeFrom": "2026-09-01T00:00:00.000Z" },
        "completion": { "kind": "one_time" } },
      "createdAt": "2026-01-01T00:00:00.000Z" },
    { "id": "journal", "title": "Write in journal",
      "status": { "activation": { "kind": "always_active" },
        "completion": { "kind": "periodic", "intervalDaysSinceLastCompletion": 7 } },
      "createdAt": "2026-01-01T00:00:00.000Z" },

    { "id": "finances", "title": "Finances",
      "status": { "activation": { "kind": "always_active" } },
      "createdAt": "2026-01-01T00:00:00.000Z" },
    { "id": "review-monthly-budget", "title": "Review monthly budget",
      "status": { "activation": { "kind": "always_active" },
        "completion": { "kind": "periodic", "intervalDaysSinceLastCompletion": 30 } },
      "impact": "medium",
      "createdAt": "2026-01-01T00:00:00.000Z" },
    { "id": "file-taxes", "title": "File taxes",
      "status": { "activation": { "kind": "always_active" },
        "completion": { "kind": "periodic", "intervalDaysSinceLastCompletion": 365 } },
      "impact": "critical",
      "createdAt": "2026-01-01T00:00:00.000Z" },
    { "id": "setup-emergency-fund", "title": "Set up emergency fund",
      "status": { "activation": { "kind": "always_active" },
        "completion": { "kind": "one_time" } },
      "createdAt": "2026-01-01T00:00:00.000Z" },

    { "id": "home-admin", "title": "Home & Life Admin",
      "status": { "activation": { "kind": "always_active" } },
      "createdAt": "2026-01-01T00:00:00.000Z" },
    { "id": "clean-apartment", "title": "Clean apartment",
      "status": { "activation": { "kind": "always_active" },
        "completion": { "kind": "periodic", "intervalDaysSinceLastCompletion": 7 } },
      "createdAt": "2026-01-01T00:00:00.000Z" },
    { "id": "organize-paperwork", "title": "Organize paperwork",
      "status": { "activation": { "kind": "always_active" },
        "completion": { "kind": "one_time" } },
      "createdAt": "2026-01-01T00:00:00.000Z" },
    { "id": "grocery-shopping", "title": "Grocery shopping",
      "status": { "activation": { "kind": "always_active" },
        "completion": { "kind": "periodic", "intervalDaysSinceLastCompletion": 5 } },
      "createdAt": "2026-01-01T00:00:00.000Z" }
  ],
  "edges": [
    { "id": "e-health", "childId": "health", "parentId": "root", "contribution": "mandatory" },
    { "id": "e-exercise", "childId": "exercise", "parentId": "health", "contribution": "mandatory" },
    { "id": "e-workout", "childId": "workout-session", "parentId": "exercise", "contribution": "mandatory" },
    { "id": "e-meditate", "childId": "meditate", "parentId": "health", "contribution": "helpful" },
    { "id": "e-checkup", "childId": "health-checkup", "parentId": "health", "contribution": "mandatory" },
    { "id": "e-hydrate-health", "childId": "stay-hydrated", "parentId": "health", "contribution": "helpful" },
    { "id": "e-hydrate-exercise", "childId": "stay-hydrated", "parentId": "exercise", "contribution": "helpful" },

    { "id": "e-career", "childId": "career", "parentId": "root", "contribution": "mandatory" },
    { "id": "e-project", "childId": "current-project", "parentId": "career", "contribution": "mandatory" },
    { "id": "e-presentation", "childId": "prepare-presentation", "parentId": "career", "contribution": "mandatory" },
    { "id": "e-lessons", "childId": "online-lessons", "parentId": "career", "contribution": "helpful" },

    { "id": "e-relationships", "childId": "relationships", "parentId": "root", "contribution": "mandatory" },
    { "id": "e-call-family", "childId": "call-family", "parentId": "relationships", "contribution": "mandatory" },
    { "id": "e-friends", "childId": "plan-friends-meetup", "parentId": "relationships", "contribution": "helpful" },

    { "id": "e-growth", "childId": "personal-growth", "parentId": "root", "contribution": "mandatory" },
    { "id": "e-read", "childId": "read-a-book", "parentId": "personal-growth", "contribution": "mandatory" },
    { "id": "e-spanish-online", "childId": "learn-spanish-online", "parentId": "personal-growth", "contribution": "helpful" },
    { "id": "e-spanish-class", "childId": "take-spanish-class", "parentId": "personal-growth", "contribution": "helpful" },
    { "id": "e-journal", "childId": "journal", "parentId": "personal-growth", "contribution": "helpful" },

    { "id": "e-finances", "childId": "finances", "parentId": "root", "contribution": "mandatory" },
    { "id": "e-budget", "childId": "review-monthly-budget", "parentId": "finances", "contribution": "mandatory" },
    { "id": "e-taxes", "childId": "file-taxes", "parentId": "finances", "contribution": "mandatory" },
    { "id": "e-emergency-fund", "childId": "setup-emergency-fund", "parentId": "finances", "contribution": "mandatory" },

    { "id": "e-home", "childId": "home-admin", "parentId": "root", "contribution": "mandatory" },